{
  "id": "3b4c5d6e-7f8a-4b9c-0d1e-3f4a5b6c7d8e",
  "type": "maintenance.predicted",
  "source": "predictive-maintenance",
  "time": "2025-01-15T09:00:00Z",
  "data": {
    "bus_id": "8a2c4e6f-1b3d-4a5c-8e9f-0a1b2c3d4e5f",
    "component": "fuel_cell",
    "risk_score": 0.82,
    "predicted_failure_at": "2025-01-29T09:00:00Z",
    "model_version": "rules-0.1.0"
  }
}
